,Review_Page_Number,Ratings,Title,Posting_Date,Used_For,Review_Body,Whether_Recommended
256,13,4,Really glad I got these!,2020-08-26 11:48:00,1 month,"Before I got these AirPods, I had just bought the latest version of JLab  Air Icons because the reviews were so great- with a very affordable price. Mistake! When I reviewed the JLabs I was still on the fence but giving them a chance. No matter which size of the cusions/sleeves I used-- they were always uncomfortable in my small ears and I couldn't even use with phone calls because of echo/muffled sound.
 
I decided to return them when I saw the first gen Airpods on sale at Best Buy.  The reason I didn't go right to AirPods was because of the price- I've always thought it pretentious and unnecessary of Apple to charge so much for their products! But truth is, they make good products and I love these  AirPods! They fit like traditional Apple earbuds which have always been comfortable for me.  So I finally have wireless earbuds that are comfortable and I am actually using! The only drawback is it's not great quality while using with phone calls. There's a sort of hollow sound, but they do work and work better on the phone than the JLabs did, therefor I'm giving them an Excellent for Quality. 
So... I'm happy with these pretentious costly little things!!",1
257,13,5,Super Convenient,2019-09-13 19:47:00,3 weeks,"I swear it's not only for the looks you get but the stereotypical ""I can afford AirPods"" appearance will definitely attract similar individuals with ""electric-toothbrush-head-looking"" earphones hanging from your ears. But in all seriousness, if you're in the Apple ecosystem (have iPhone, iPad, MacBook, etc.), this is the most convenient, truly wireless, smallest package you can get. 

Cons:
-Sound quality is only as good as the EarPods that come with your older iPhones. No bass, and not much volume. 
-Only good for Apple devices, pairing through android devices require additional setup in the Bluetooth settings.
-Kind of obnoxious
-Can be lost easily if they do not fit snug in your ears
-Price is high
-No water resistance or IP rating (be careful to dry them off if you plan on using these for the gym!)


Pros:
-Very light and easy to travel with
-Seamless pairing with Apple devices (switching across Apple devices is easy too)
-Battery life is great (I'm averaging 1.5-2 days on a full charge)
-This version has no wireless charging capability (charges only with lightning cable) , but you can upgrade to the $179 for that
-Decent build quality-both case and AirPods themselves

I really hesitated on this one but after I tested a friend's, I was convinced that the device integration is too great to pass up.",1
258,13,5,The Perfect Fit,2023-05-24 20:38:00,Not Available,"I got my first pair of AirPods a few years ago, and have most recently gotten new ones for Christmas. I listen to music all day every day and couldn’t go a day without it, so I needed to buy headphones that would support what I was looking for. The sound quality on AirPods varies depending on the generation you buy, so why didn't I just buy the newest generation and call it a done deal? Well, I didn't only want the quality to sound crystal clear, I also wanted them to be comfortable to wear for hours on end, I didn’t want big bulky headphones I couldn't bring anywhere, and I wanted a long battery life. One of the very major audio differences between the 2nd Gens and the 1st Gens is the bass. The bass system for the 2nd Gen AirPods is upgraded, new, and improved, and sounds great. The 2nd Gen AirPods may not have the best sound quality out of all of the generations, however, personally, I feel 2nd Gens are far more comfortable than the others. Even with the AirPod Pro “seal”, 2nd Gen AirPods are more comfortable to wear and don’t “fall out of your ears” which several people who have purchased the AirPod Pros have complained about. Obviously, this specific kind of AirPod is not an actual pair of headphones, which I was trying to stay away from, so that eliminated the AirPods Max - which are Airpods over-ear headphones. My final requirement for my earbuds was long-lasting battery life to last me throughout the day. Luckily, the 2nd Generation has a 24-hour battery life, as well as a case that has several full charges built in. The “Perfect Pair” for me may not be the same as you so do research and explore your own needs and requirements! But, if you're like me and have similar needs or wants for earbuds, consider buying these! The 2nd Gen AirPods have been my favorite pair of earbuds for years, maybe they will be yours too!",1
259,13,4,Pretty Good for the Price.,2023-02-20 13:11:00,1 month,"Like all things in the Apple ecosystem, they're a bit overpriced. Sure, they're ""pretty comfortable"" and they sound ""pretty good."" The pairing is quick and easy, and they don't stick straight out of your ears like most other brands.

That being said, they're Apple. That means you're either going to accept the price and the color, or you're going to complain about them for no reason. I hate to say this, but I paid too much for these EXCEPT they went on sale one day after I bought them, and Best Buy was good enough to refund the difference the next day. So for what I really paid, they're ""pretty good.""

What kills me most is how Apple suckers you into buying too much stuff. THESE DO NOT HAVE WIRELESS CHARGING - If you want wireless charging, just spend the extra cash for the 3rd generation. It's not worth buying these, and then spending another $79 for an upgraded case for them, unless you REALLY need to have THIS shape instead of the 3rd generation.

One big complaint however. The case lid does not close flush all the way around. I know that sounds like a first-world problem that only an Apple person would complain about, but it allows pocket lint and whatnot to enter the gap in the case. That FOD then gets jammed into the hard-to-clean parts of the case, and looks pretty gross after just a little while.

Overall, Apple really did make these things mainstream and streamlined, and AirPods are probably the best wireless earbuds you're going to find. I never thought I'd say such a thing. I still hate that I've gone to the dark side though, especially since they don't even come in black.",1
260,14,5,"Surprised, though I shouldn't have been",2019-09-13 16:17:00,1 month,"First off, I've always liked Apple's included EarPods with each iPhone I've had. Yes, I'm deep in the Apple ecosystem. For a while I have been using a pair of PowerBeats3 for music listening with my phone. I always found them to not fit quite right or not fit me correctly. I got the AirPods and they fit just like the wired EarPods in my ears. Good for me, maybe not for you. THAT more than anything should help you decide to buy these or not. They stay in my ears but I would be wary using them for runs or heavy aerobic exercise. There are third party kits out there that add hooks and neck straps and such to make the more fitting to such use.

What I like about AirPods that was the reason I originally bought the PowerBeats3 is that once they're paired to one Apple device, they are paired to all of them. I can be listening on my phone, get home, hop on my MacBook and with a click my home library is playing in my ears instead. Multiple Macs, your phone, maybe a tablet, this was a handy feature and heavily used by me. Controls can be mapped to tap controls on the pods themselves. Personally, I like play/pause and call answering on the right and track skipping on the left. What I miss is volume control. It's a drawback to use one's phone or Apple Watch to control an important portion of AirPods use but that's the trade off. Compared to many other bluetooth headsets battery life is low. However, compared with other completely wireless buds the numbers are closer. Considering the size of these it's really a feat how much they do pack. Then there's the charging case that holds an extra charge.

My impressions are this: others hear me clearly and clean. One pod is drained more than the other, it's basically the master tying them both to the device for signal, input, output, etc. But what surprised me that I did not expect was when I went back to my PowerBeats... I think the AirPods sound better. Again, it could be an ear canal issue since these fit me better I hear the highs and lows, trebles and basses. I really enjoy these and only lament a volume control. They are hardly out of ears.",1
261,14,5,Greay,2019-08-24 09:09:00,3 weeks,"After using the AirPods for several hours a day for a month, there's a lot to like about Apple's first foray into truly wireless headphones. I used the AirPods just one bud at a time while listening to music/podcasts and for short phone calls in an office setting. Pros: Bluetooth Connection: Due to Apple's W1 chip, the bluetooth connection is very strong, seemingly up to and beyond 30-50 feet. I was able to walk downstairs in a building and still maintain connection while my iPhone was still on the second floor. Also, the phone reception seems strong as whenever I was on the phone people generally heard me fine. Auto Stop: If you're listening to music and you remove one of the buds, whatever you're listening to will stop automatically due to sensors in the buds. I've used this feature countless times, especially whenenver someone starts a conversation with me while I'm listening to music while sitting at my desk. Now I just remove the buds(s) and I don't have to worry about fumbling around for the ""pause"" button either on my headphones or iPhone. Single Pod: I nearly always use the AirPods just one bud at a time, both in an effort to conserve battery life and to be more aware of my surroundings. This is a huge plus for me, since I'm used to the neckband-style headphones in which one of the buds was never used (and usually just dangled down the front of my shirt). Also a plus is that there's a microphone in both buds, rather than just a single one. Case: An underrated element of the AirPods is the thing that you don't actually put in your ears. It's the charging case. This thing will always be by your side, because once you take one of the buds out, there's nowhere to put it without risk of losing it. The buds magnetically lock into place in the case, so once they're in, they're not going anywhere, even with the case lid open. The case itself could feel a little sturdier as you'll almost want to buy a case for your case, but it's a great way to keep both pods and the charging system all in one little package that's barely larger than a pack of floss. Charging: Whenever you put the buds in the case, they'll automatically start changing. And these things charge fast. I placed one bud in the case once its battery life was down to 11% remaining and in exactly 10 mins it was already up to 77%. You do have to charge the case itself occasionally, but as long as you have the case around, the 5-hour battery life will never become an issue. Pairing: Thanks to Apple's W1 chip, these are the easiest bluetooth headphones to pair for iOS devices. For intial pairing, simply open the top of the charging case next to your iOS device, tap ""connect"" on the popup, and that's it. No messing around in the Settings section of your device, no holding a combination of buttons a certain number of seconds. And everytime after that, simply remove the bud(s) from the case, place it in your ear, and you'll be automatically connected. Convenience: This might be the AirPods' biggest pro. I'm not sure the convenience of a truly wireless experience and automatic pairing can be overstated. Being able to pop a single bud in your ear, have it connect automatically, and almost always have a full battery is like magic. Taking the headphones off and not having to turn them off/on is also a nice cherry on top.",1
262,14,4,Great for Apple device owners,2021-08-05 13:05:00,Not Available,"Great headphones. Especially if you're in the Apple ecosystem. They automatically connect to my iPhone, iPad, AppleTV - whatever I'm using at the moment. Compact and fits well. Can be used while laying on your side with no discomfort. Only knock her is battery life. With higher volumes or noise canceling on you'll only get get a lot of playback. So that sucks. The good thing is that you can get a quick 3-5 recharge and you'll be good to go again. The device tracking in the Apple Find My app is helpful so see where you last used it. The ping location sound is also helpful to track them down further. Price is high for what you get, but that's typical Apple; besides they do offer some features with Apple devices you just can't get anywhere else.",1
