,Review_Page_Number,Ratings,Title,Posting_Date,Used_For,Review_Body,Whether_Recommended
214,11,4,Good product,2021-07-23 17:10:00,3 weeks,I have had this product for almost a month and I am very happy with it. They stay in my small ears when working out and they have a reasonable usage time before I have to recharge. The sound quality is quite good. It did take a little getting used to the having the audio stop when you pull one bud out of your ear. I hope I never lose or misplace one or the system will be worthless.,1
215,11,5,Makes driving and talking a lot easier,2020-01-03 18:58:00,3 weeks,Talking through my car always had an echo but now no one complains when I call with the AirPods!,1
216,11,4,Great Apple Product,2019-05-17 18:44:00,Not Available,If you’re invested in the iOS ecosystem the AirPods will come handy. Not only do they seamlessly connect and work with all iOS devices but they are quite portable and sound great.,1
217,11,5,Apple didn't disappoint!,2021-01-01 05:06:00,1.5 years,"I simply love these Apple Airpods. They are very sleek and work seamlessly with my iPhone, iPad, and MacBook. This is simply a must if you are invested in the Apple ecosystem. The sound quality is decent and the simplicity of them makes them a great buy.",1
218,11,5,Great for people on the move,2020-06-19 17:10:00,1 month,"I use these for calls and when I want to listen to videos without disturbing others in the room, They proved invaluable when I needed to be on YouTube and Facebook for  Sunday services - and wanted to be mobile - The AirPods are very comfortable and  the sound is very clear - No echo ..Wish they held the charge for a bit longer...",1
219,11,5,Great product,2019-09-20 16:54:00,1 month,"Great portable product. If you are in the Apple ecosystem, this product will be even better. It will let you switch between an iPhone and a Mac or iPad. The sound quality is OK. Battery life is fine. With the case, you are fine with two days.",1
220,12,5,Awesome and easy to use!,2019-10-30 00:30:00,1 month,"The sound quality isn’t the best but is good enough. The paring process, battery life, small form factor and comfort of them more than make up for any of its short comings. If you are in the apple ecosystem these are a must have.",1
221,12,5,Definitely a great purchase!,2021-07-27 18:10:00,8 months,"Either these are excellent or my DA husband is just very lucky. I vote both! Originally bought these for me Nov 2020 but my husband soon took over them. He is a FedEx delivery driver and these make his day much better! After six months of using them, He lost his case one day (with a case cover on it) on his route with one head phone in it. Four days later, he finds it in a customers yard. He was so happy to find them (because the cheap knockoff from Walmart wasn’t cutting it) but wasn’t sure if they would still work because there was a terrible storm over the weekend plus the customer had a sprinkler system.. low and behold, it still work perfectly fine!! Now, forward about 2 months, he put one headphone in his pocket b/c his case wasn’t handy and forgot about it… washed it TWICE and dried in the dryer before he found or realized he left it in his pocket.. he charged it, put it in his ear and STILL WORKS PERFECTLY!!",1
222,12,5,Good Value,2021-12-06 00:18:00,1 week,"Cheap pair, good as gift for Christmas.

Having owned a pair, I can say these are very good earphones. They work well within the Apple ecosystem. I can connect quickly with my iPhone and switch to my iPad automatically.
These fit better in my ear compared to the Pro models.",1
223,12,4,Better than many other options,2019-10-29 11:53:00,1 month,"I bought these and found them a bit uncomfortable. I tried two other options and although felt a bit better, I didn’t like the echo from them and the microphone was terrible. I have had no issues with this Apple device. Easy pairing also.",1
224,12,5,Airpods,2021-01-27 21:01:00,1 year,These are obviously a great experience in the Apple ecosystem with how easily they pair with a device and work immediately with your phone every time. I've never had an issue with either ear disconnecting while using them or had trouble pairing them. The case easily fits in my pocket and I always have headphones in my pocket with no wires.,1
225,12,5,Happy camper,2020-12-28 00:11:00,3 weeks,I like them. Music sounds great. Phone calls sound great. Had cheap Bluetooth sets in the past that were absolute garbage compared to these. Apple makes them easy to sync and work with my entire ecosystem of Apple products flawlessly. Scored them Black Friday for like $100 so no complaints here.,1
226,12,5,Great product for Apple users,2021-01-02 10:55:00,Not Available,"Fantastic product for the Apple ecosystem. It’s super easy to pair to your Apple ID and devices, and the audio quality is good enough for headphones. The microphones work extremely well for calls, and so a decent job removing background noises.",1
227,12,5,Great wireless headphones,2020-04-18 12:17:00,2 weeks,If you live in the Apple ecosystem then these headphones are a no brainer. They pair seamlessly to your Apple devices and the sound quality is pretty good. Very convenient to keep in your pocket. Their low profile and light weight makes them great for travel and being on the go.,1
228,12,5,Great gift!,2021-02-04 20:46:00,Not Available,"I purchased this as a gift for my mom. I also own a pair. I love them! I love how they integrate with the Apple ecosystem. The only draw back is the battery life, especially when you use them to talk on the phone.",1
229,12,5,Great headphones!,2020-01-12 16:58:00,1 month,"If you are in the Apple ecosystem this is a great pair of headphones!  I use these with me watch, laptop, and phone.  Easy to switch headsets from one device to the other.  Really good sound quality (primarily use for calls and video conferencing). Would def recommend.",1
230,12,5,Favorite bluetooth headphones!,2019-08-31 12:11:00,3 months,"The quality is great, and it both charges and connects to my devices quickly. Though, having owned the first pair of AirPods, these aren’t at all worth the upgrade, but I would recommend buying them if you didn’t purchase the first generation and have devices in the Apple ecosystem.",1
231,12,5,Set up was a breeze,2020-07-21 17:56:00,1 week,Setting these up was the simplest and easiest piece of tech I have ever set up in my life.  Once you open the case the Air Pods all most do everything automatically.  These are great if you are already part of the Apple ecosystem.,1
232,12,4,Solid sound & utra portable (fit?),2020-09-21 15:00:00,1 week,"What’s great?
— small case, fits in your pocket
— solid sound for it’s size
— great connectivity for Apple ecosystem
— good price for quality product

Not so great?
— Battery life is ok (compromise for portability)
— May fall off your ears (for some like me)

In Summary, if they fit you right — you won’t be disappointed.  Had to return mine :(",1
233,12,5,"These are convenient, sound great and great price",2019-11-29 19:38:00,Not Available,"These is by far the best product by apple. They were late to the party, but boy, they have innovated. They were priced on the higher side, but they are so easy-to-use and with all the apple ecosystem, such convenient to connect. They sound great, the only downside is the battery life, but they charge super fast, so if you are looking for everyday, wireless earphones and have apple products, look nowhere, this is the product for you!",1
234,12,4,I love these things,2019-06-28 18:13:00,1 month,"I travel every week. AirPods are great for making calls and have great sound. They stay in my ears no matter what.

Why 4 stars instead of 5? I have accidentally left 2 pairs in rental cars (National Rental Car will always deny finding them)  and had 1 pair stolen so this is my 4th pair. Apple need to find a way to register them and either shut them down or find them when lost/or connected to another phone. Perhaps a two factor authentication system?",1
235,12,5,Love These AirPods!,2019-06-12 15:09:00,Not Available,"I bought the new AirPods for my son and he loves them! Great sound quality, ability to connect with siri and our Echo dots and easy to answer calls. Definitely worth the investment.",1
236,12,3,Good wireless buds to start with !,2020-05-21 07:53:00,1 month,As being a part of Apple ecosystem. I was meant to try these out. They are quite effective for wireless buds. They are light weight and quite recognizable. There are some issues with battery life when u talk over phone and listen to some peculiar music with heavy base action. And more deep claws so won’t come off easily while running.,1
237,12,5,Great Clarity!,2019-09-02 16:28:00,1 month,"These pods are great!
The price tag you see is worth the money because the clarity on the pods is fantastic.  At first I thought, “ These are over priced standard corded ear buds.”  That is not the case.  It takes a little time to follow instructions to sync them to your iPhone but after that, it is easy street.  Charging is fun and easy and it really fits into the Apple ecosystem.  You just have to get used to carrying a high priced detachable item so you will not loose them.  Have fun and enjoy.",1
238,12,5,Best pair of headphones for the price,2022-11-15 10:07:00,more than 2 years,Can't ask for a better pair of headphones that work in the Apple ecosystem. Made work from home and remote learning ten times better as I did not have cables getting in the way. These are easy to use and maintain; although highly suggest getting a cleaning tool to keep the inside of the case clean especially if you have dirty ears.,1
239,12,5,Best Wireless Headphones,2020-05-05 17:26:00,9 months,"During quarantine I needed to be able to use my iPhone for both calls and Zoom meetings without the hassle of wires getting in the way.  Most of my other headphones seal the ear canal, which is great for limiting noise, but then I hated the echoing sound of my own voice in my head.  These fit nicely without completely sealing the ear canal and work flawlessly with the iPhone...not to mention the range for such a small device is amazing.",1
240,13,3,Superb headphones that just don't fit everyone,2020-12-03 11:59:00,2 weeks,"Integration with the Apple ecosystem is superb but the fit is not even close as the wired earpods. Sound also seemed to be lower than the wired ones. I'm not sure if I received a faulty product but I had to always keep it at 60-70% volume to get a decent sound out of it. 

The fit is really loose, there are solutions like silicone tips but most of them won't fit in the case so it's an added duty to put them on and off before and after using them. 

I'd suggest just invest the difference and go with the Airpods Pro or just go with some other options.",0
241,13,1,Horrible battery life,2020-10-21 16:56:00,Not Available,"Great headphones while they last, but the battery life is horrible. After 2 years usage, airpods last 20 minutes after full charge. Very bad design which doesn't allow you to change batteries, the only way out is to replace the airpods which both cost almost the same as the new ones, the design is by purpose by apple who want you to buy a new pair every couple of years. this is not eco friendly at all. In the age of Tesla, where batteries last for 100000 cycles this seems like very outdated battery technology. I am in search for non apple pods",0
242,13,4,Good all around performance,2020-02-14 19:16:00,1 month,"Love these, got them for my daughter. However, I bought the echo buds for myself and really enjoy the ability to toggle between “amplified” pass through and noise reduction modes for less money. My daughter still loves the Apple products, and you can’t go wrong with them.",1
243,13,4,They're AirPods.  What more do you need to know?,2019-07-29 14:00:00,Not Available,"Well, as a long time apple ecosystem user, I finally broke down and bought some AirPods.  I delayed as long as I could but once you have no wired headphone jack, your choices are somewhat set.  These headphones connect easily, work consistently and have good sound.
I find the form factor uncomfortable for small ears and am disappointed that there is no 'give' in the product.",1
244,13,5,Perfect!,2020-08-20 08:10:00,less than 1 week,"Super easy to use and very good sound quality. I tried skimping out with other less expensive brands and even other more expensive fancy brands offering more features. After wasting time and money trying other brands, I’m glad that I finally gave these AirPods a try. They work seamlessly between my multiple Apple devices with a simple tap or 2. You pair them once and they’re automatically connected to the rest of your Apple ecosystem - Apple Watch, iPhone, iPad, MacBook. Just click and switch. Literally that simple. Love these and highly recommend for Apple users.",1
245,13,5,This model fits comfortably in the ear.,2022-04-07 10:32:00,1 month,"First of all, I would like to start by stating that it does not work well with android. But working performance with apple products is excellent. Bass and treble are fine, in my opinion. Of course, if the only purpose is to listen to music, there are better music headphones for that price. But how many are only 8 grams? You do not realize whether you put it in your ear or not. Lightweight and stylish. In addition, the box is also very light and modern. You can listen to music for about 4.5 hours. In addition, if you have an Apple ecosystem, switch between devices, etc., the connection time was also very successful. Loudness is also perfect. The only minus side is that it fails to cut out the sounds coming from outside.",1
246,13,5,Did Not Meet My Needs,2023-01-12 12:00:00,less than 1 week,"The sound quality was very good. I ordered these to use as hearing aids meaning the microphone needed to be on all the time like my EarPods gen 2 which stopped working. Unfortunately, the microphone only works when in active listening mode which provides an echo effect. Also, did not work well when answering a call. Good product, just not what I needed.",1
247,13,5,Excellent quality ear buds!,2023-05-27 00:43:00,1 month,"Perfect for those zoom meetings you don’t really wanna be seated for. Can connect and walk away and still hear everything. Great sound quality. No echo during phone calls. If one falls out of your ear, the sound stops in both immediately so you’ll know you dropped one which helps prevent losing them if you’re paying attention. Could have better battery life but they charge quick when placed back inside the case and you’ll be good to go again in under an hour. All in all, happy with my purchase. I use them more than I thought I would. Wish I had purchased sooner!",1
248,13,4,Awesome connectivity,2019-04-30 22:18:00,Not Available,"If you’re in the Apple ecosystem, then this is the best for seamless connectivity between iPhone to MacBook to iPad to Apple TV. Out of all the other wireless Bluetooth earphones, this turns on as soon as you put it in your ear. I wish I had bought these earlier instead of the BeatsX which malfunctioned just after the 1 year warranty period. 
Two drawbacks are 1) it doesn’t fit my ears properly so I have to put some nonslip cushioned tape on them so they don’t fall out of my ears and 2) they are ugly and looks ridiculous like sticking Sonicare toothbrush refills in your ears.",1
249,13,4,Airpods,2021-04-16 18:22:00,1 month,"This is the first set of wireless earbuds I’ve ever purchased. Overall they work great for listening to music. They however echo when I use them for phone calls, so callers tell me anyway. Outside of that I am genuinely happy with their performance. The battery life is very good. I don’t have a specific time line but they will last all day when taking them out and placing them in the carry case that acts as a charger when not in use.",1
250,13,5,"Great product, great sound quality!",2019-08-09 18:23:00,1 month,"The AirPods are great quality. They automatically connect to your Apple device and can easily transition to another device (i.e. iPad). The sound quality is also great. The sound doesn’t completely block out background noise, which for me is a perk. This allows you to walk down the street or ride a bike while still being aware of your surroundings. Using them to make a call, there are no complaints from the other line about fuzziness or echoing. The case is very small which makes them super portable. Overall, I am very satisfied with my purchase and I recommend them to others!",1
251,13,3,"Good, quality earbuds...kinda",2020-01-17 16:42:00,1 week,"I am deeply invested into the Apple ecosystem. I have everything Apple....except these earbuds. My son bough it for himself with his Christmas $. I like them for a few reasons - decent sound, elegant charging case, functionality. What I don't like is the price and the ""fit"" for active folks. I feel like you get a better sound and ""fit"" with the Bose wireless earbuds for less $. I like the look of the Apple wireless earbuds...but I'm not sure I want to pay another $50 for a better looking earbud. I'm not sure if I have weird ears but the Apple earbuds have never been comfortable to me and ALWAYS falls out of my ears when I'm going hard on a workout. Can't have that. That's the reason I give it 3 stars. For chilling it's a better option and probably a 4 or 5 star option. Hope this helps someone.",1
252,13,5,Seamless Sound and Wireless Freedom,2023-07-10 12:11:00,1 year,"Having used the AirPods extensively, I can confidently say that they are a game-changer in the world of wireless earbuds. Apple’s AirPods combine cutting-edge technology with sleek design, delivering an exceptional audio experience. Here’s my in-depth review of the AirPods.

Design and Comfort:
The AirPods’ design is simple yet elegant, featuring a minimalistic white look that has become iconic. The earbuds are incredibly lightweight and fit comfortably in the ears, thanks to their ergonomic shape. They stay securely in place even during workouts or active movement, ensuring a hassle-free experience.

Wireless Connectivity:
Pairing the AirPods with your Apple devices is a breeze. The seamless integration with the Apple ecosystem allows for effortless connection and automatic pairing across devices associated with your iCloud account. Once connected, the AirPods offer a stable and reliable wireless connection, eliminating the inconvenience of tangled cables.

Sound Quality:
Despite their compact size, the AirPods deliver impressive sound quality. The audio is clear, well-balanced, and immersive. The integration of Apple’s audio technologies ensures that you can enjoy your favorite music, podcasts, or videos with rich detail and depth. Whether you’re listening to classical music or watching an action-packed movie, the AirPods provide an enjoyable and immersive audio experience.

Intelligent Features:
The AirPods come equipped with a range of intelligent features that make them stand out. They automatically pause playback when you remove them from your ears and resume when you put them back in. The built-in accelerometers and optical sensors work seamlessly to detect your actions and adjust accordingly, ensuring a seamless and intuitive user experience.

Battery Life and Charging:
The AirPods’ battery life is impressive, offering several hours of continuous playback on a single charge. The charging case provides additional battery life and serves as a convenient storage solution. With the ability to quickly charge the AirPods within the case, you can enjoy uninterrupted listening throughout the day.

Siri Integration:
Accessing Siri with a simple voice command is a convenient feature of the AirPods. You can ask Siri to play music, make phone calls, adjust volume, or get directions without needing to reach for your phone. This hands-free functionality adds an extra layer of convenience and enhances the overall user experience.

Conclusion:
The AirPods offer a compelling package of seamless wireless connectivity, exceptional sound quality, and intelligent features. Their sleek design and comfortable fit make them perfect for everyday use, whether you’re commuting, exercising, or simply relaxing. With long battery life and easy integration into the Apple ecosystem, the AirPods provide a hassle-free and enjoyable listening experience. If you value convenience, sound quality, and wireless freedom, the AirPods are a must-have accessory that will enhance your audio experience and bring a new level of convenience to your daily life.",1
253,13,5,best earpods,2023-08-28 17:57:00,4 months,"First and foremost, the sound quality is simply outstanding. The AirPods deliver crisp, clear, and immersive audio that brings music, podcasts, and movies to life. The balance of bass, midrange, and treble is perfectly calibrated, ensuring an enjoyable listening experience across a wide range of genres. Whether I'm rocking out to my favorite tunes or engrossed in an audiobook, the sound reproduction is flawless.

One of the standout features of the AirPods 2nd generation is their seamless connectivity. Pairing them with my iPhone was effortless, thanks to the intuitive and efficient pairing process. The moment I removed the AirPods from their case, they instantly connected to my device, allowing me to indulge in my audio content without any hassle. Furthermore, the Bluetooth connection remains stable and reliable, enabling uninterrupted playback even when I'm on the move.

The design and comfort of the AirPods are also praiseworthy. They fit snugly in my ears and stay put, even during intense workouts or walks. The lightweight construction ensures that I can wear them for extended periods without any discomfort. Additionally, the absence of wires makes them incredibly convenient, eliminating the hassle of tangled cords while providing the freedom to move around effortlessly.

The battery life of the AirPods is remarkable. The earbuds themselves offer around five hours of continuous playback, and the accompanying charging case provides multiple additional charges, extending the total usage time. The charging case is compact and easy to carry, ensuring that I can keep my AirPods powered up on the go.

Another feature that has truly impressed me is the integration with Apple's ecosystem. The AirPods seamlessly sync with all my Apple devices, allowing me to switch between them effortlessly. Whether I'm listening to music on my iPhone, watching videos on my iPad, or taking calls on my MacBook, the transition is seamless, and the AirPods automatically connect to the active device.

Lastly, the AirPods boast a range of intelligent features, including Siri integration and touch controls. With a simple tap, I can summon Siri to perform various tasks, such as adjusting the volume, skipping tracks, or answering calls. The touch controls are responsive and intuitive, making it easy to manage my audio playback without needing to reach for my device.

In conclusion, the Apple AirPods 2nd generation have exceeded my expectations in every way. They deliver exceptional sound quality, provide convenient wireless connectivity, and boast a sleek and comfortable design. With their long battery life and seamless integration with Apple devices, they have become an indispensable companion for my daily routines. If you're in the market for wireless earbuds that offer a premium audio experience, the AirPods 2nd generation are an excellent choice. Highly recommended!",1
254,13,5,Genuine Apple with Apple quality,2021-06-12 07:45:00,1 month,"Genuine Apple, all you really need to know.

Apple is the Lexus of electronics, luxury & dependability a great combination.

This is my 3rd pair of these. Buying using my Best Buy Points.

The longer I own Apple products the more I appreciate the Apple system, how everything works together, and does just that, actually works & works well.

These AirPods hold a charge & so does the case for them, so if they run low, you put them back in the case for a few minutes and the come back charged up.

The AirPods are comfortable to wear.  When they 1st came out I thought they would fall out and looked a little goofy. When I got my 1st set I bought a small accessory kit to help hold them in place.  I haven’t used any of those items for them yet.

They connect easily to my phone & iPads.  A true wireless device.  It’s nice to not have the cord in the way.

These sound great for calls or listening to music.  The call quality sounds just like you would expect, no issues at all.

When you get texts, they can be set to Have Siri read Them to you and offer an opportunity to respond. So your phone can stay in your pocket. 

A quick tap on the AirPod answers calls, or can do a redial.

The little case helps to keep these clean.

Worth the price of admission.  So much that I have mine, I got a set for my wife, and a 3rd backup pair in case something gets lost.",1
255,13,2,Works great by itself - does not work while in car,2020-01-20 14:09:00,less than 1 week,"The AirPods have very good sound quality and I attend office meetings like an hour or so, quality and Mute configuration with single tap on one of air pod works perfectly.
Drawback is when u are talking on AirPods and get into your car, the iPhone switches to car Bluetooth. But when I switched back to AirPods while in car, I cannot hear anything and other people in conference meeting complained they are hearing echo. So I was completely unaware if anyone talking or on mute. So I have to switch back to car Bluetooth.

Other than usage in car, it works perfect.",1
