,Review_Page_Number,Ratings,Title,Posting_Date,Used_For,Review_Body,Whether_Recommended
102,6,3,Good as part of Apple ecosystem. Poor reliability,2019-05-17 19:58:00,Not Available,"This SKU is the wireless AirPods with Charging Case. So everyone is clear, this is the 2nd generation headphones that are wireless, but with the WIRED charging case in which you need to plug in a lightning cable. 

Battery life and audio quality are decent. Boost lower mid bass, may not be the most accurate, but give the impression of deep bass. Twisting them forwards a bit to get a firmer fit in the ear emphasizes the bass and also points the front mouth. Outgoing audio quality for calls is ok. Not great. Not good. But just okay. Barely acceptable. The other end picks up random noises, and has somewhat softer outgoing audio than better headphones for calls. Also, the audio connection drops quite a bit, so that when you think you're talking to someone, you no longer are. The audio has reverted to the handset/phone. It appears this is due to the sensor that detects being in the ear being too aggressive always thinking the ear pods have been removed from the ear, or maybe due to a defective set. 

Also very annoying is the fact there are virtually no controls on either side, so that to raise or lower the volume, skip the track or repeat a track, you need to take the phone out of your pocket. The Galaxy Buds allow you to skip forwards, repeat or skip back, adjust volume and play/pause by tapping the touch pad on either ear.

If you make a lot of phone calls, the Plantronics Voyager Focus is highly recommended. It has intuitive controls for call control and audio control, has selectable ambient noise cancellation, has a boom noise cancelling microphone, has on head/ear detection sensors, and a very easily accessed and intuitive microphone mute button on the boom. It is a bit bigger though.

For those primarily worried about call quality, the Plantronics M104 has a passive/active noise cancelling mic with a really long boom, and only covers one ear to make it most road/drive legal. This one has the best audio quality in and out (ear piece and while speaking to others) but is mono.",0
103,6,5,Nice sound,2020-10-21 18:59:00,1 month,Nice sound system. Easy to carry around with its case.,1
104,6,3,Not a good design,2020-07-17 23:07:00,3 weeks,The AirPods are too large and do not stay in your ear. You will need to get some kind of system to keep it from falling out.,0
105,6,5,Great product,2019-12-20 16:57:00,Not Available,"Love it! User friendly, solid operating system, great product",1
106,6,4,Good use,2021-03-12 16:16:00,10 months,"Great sounds system, great for working out! No hassle and they last forever",1
107,6,5,Great sound.,2020-07-10 19:50:00,3 weeks,"For a wireless system, you get really good sound for a decent price. And the audio out for the mic is good too.",1
108,6,3,Meh,2019-10-11 17:25:00,1 month,There are several wireless buds at the same price range and have more features with better durability. Once you in the iOS eco...you're in it.,1
109,6,4,Nice,2020-08-14 16:24:00,3 weeks,It’s got a good grip and pretty cool sound system.,1
110,6,5,Value when on sale.,2023-08-12 13:34:00,1 month,Good value but only when on sale if you aren't looking for fancy features. Very reliable with Apple ecosystem.,1
111,6,5,Best thing I’ve bought these year,2019-09-20 18:19:00,1 month,Great sound great charging system good warranty they help me add it to my AppleCare,1
112,6,4,Great Apple ear buds for the price.,2023-09-27 19:58:00,5 months,Fit is solid. Works great in the Apple ecosystem. Best option for wireless earbuds from Apple if on a “budget”.,1
113,6,5,Nice AirPods,2021-03-19 18:35:00,7 months,AirPods work great if you are in the Apple ecosystem.,1
114,6,5,Great pair of headphones!,2020-04-25 02:03:00,1 month,Great for of headphones! Works well with the apple ecosystem. Recommended.,1
115,6,5,Great Airpods,2020-07-15 18:54:00,4 months,Excellent and elegant product and works fine with apple ecosystem,1
116,6,5,Another amazing Apple product,2020-01-09 12:54:00,Not Available,Excellent product as expected. Loving life in the Apple ecosystem.,1
117,6,5,Airpods,2022-08-01 17:40:00,5 months,"No surprises, just works. If you are in apple ecosystem must have",1
118,6,5,Sound is good,2020-07-18 13:50:00,1 week,The sound this system puts in your ears are authentic clearer than what most expect to be from a small earpiece.,1
119,6,5,Great pods,2019-09-13 18:03:00,1 month,"Sounds great, no feedback or echos. Fits great in my ears.",1
120,7,5,Calls > music,2021-09-03 14:22:00,1 year,Great if you live in the apple ecosystem.  Great for calls a bit lacking for music.,1
121,7,5,Great airpods,2020-07-03 15:11:00,1 year,I love these airpods. I use them on a daily basis and battery and sound system is awesome!,1
122,7,5,Amazing,2021-06-18 15:48:00,8 months,Amazing if you’re already in the Apple ecosystem and have other apple products,1
123,7,5,Excellent product,2019-10-04 16:49:00,3 weeks,I love Apple AirPods product. Great sound System And very easy to carry to everywhere.,1
124,7,5,So nice,2019-11-08 16:57:00,3 weeks,So far so good very nice sound system .. music is so clear .. I really enjoyed,1
125,7,5,Excellent sound with no wires,2019-12-06 20:38:00,1 month,"Great sound, battery life, and charging system! 
Much better than the knockoffs. Automatically pick up iPhone or iPad.",1
126,7,5,good purchase,2020-01-10 18:07:00,3 weeks,good true wireless earbuds especially if you’re already into the apple ecosystem,1
127,7,5,Most convenient wireless earbud,2019-12-13 16:42:00,3 weeks,The tight integration with iPhone and the Apple ecosystem make these a must have.,1
128,7,5,No one beats Apple,2019-10-19 20:00:00,2 months,This is an amazing product! And if you are into Apple ecosystem nothing can beat this,1
129,7,5,Good sounds quality,2023-07-15 22:37:00,3 weeks,"I love these they sound good, there’s no echo on other end of calls",1
130,7,4,Works great if you have the Apple Ecosystem,2019-04-22 20:26:00,Not Available,"Pairing is seamless if you have Apple products. MacBook, phone, iPad, etc. No learning curve. Could also pair with Windows although of course not as seamless. Fit is not perfect but rarely falls unless you are doing something extraneous. Sound quality is not the best but decent. Call quality is amazing. Wish that they have more options for controls (i.e. single tap, volume controls, etc). Not perfect but if you have the Apple Ecosystem, it is worth it.",1
131,7,4,Best and most convenient for iOS users,2019-12-13 16:04:00,3 weeks,Integrate seamlessly with the Apple ecosystem. I recommend them to anyone with an Apple device.,1
132,7,5,Another 5 Star Apple Review!,2020-05-23 06:42:00,3 weeks,AirPods work as promised. Fine sound quality for music while walking. Excellent connectivity when using with my iPhone XR for phone conversations. Charging system works well. Great for video conferencing such as ZOOM over my iPad Pro. By purchasing the AirPods I continue to find that Resistance is Futile in the Apple ecosystem (read cube!).,1
133,7,5,Great everyday earphones,2023-02-18 16:18:00,2 months,Great product and doesn’t disappoint. Audio quality is not the best but it blends in very well with Apple ecosystem.,1
134,7,5,Buy,2021-03-26 17:10:00,3 weeks,"Very good sound, but what makes them special is the total and easy assimilation into the Apple system. Connect fast and seamlessly with my iPhone.",1
135,7,5,AirPodLove,2021-05-07 17:21:00,1 month,"Love It 100%. I just got it to try put at work, since then I've upgraded  to the Pros. Great charging system as well",1
136,7,5,AirPod must have for it’s value,2022-11-27 11:36:00,less than 1 week,Still a great pickup if you can get it on sale and if you’re looking to get into the apple ecosystem.,1
137,7,5,excellent airports,2020-07-25 04:38:00,11 months,"Apple they made a perfect design , totally useful for even android's system like my note 9 , i tried other products from Samsung, did not like them , but air pods Apple worked perfectly with my note",1
138,7,5,AirPods are always great,2021-12-08 00:14:00,7 months,"What can I say? They’re AirPods—easy, fast connections and great integration within the Apple ecosystem.",1
139,7,5,Easy Connection,2021-03-09 08:19:00,1 month,Purchased as an addition to my apple ecosystem. Connected easily to my iphone and iPad. Great sound!,1
140,8,5,Best ever!,2020-09-19 08:56:00,less than 1 week,Thought and doubted about Apple AirPods but having Apple gadgets decided to try it and love how complements my ecosystem.,1
141,8,5,Great wireless earphones,2020-08-14 17:28:00,3 weeks,"Integrates with Apple products perfectly! If you're in the Apple ecosystem and are in need of earphones, look no further.",1
142,8,5,Great!!,2020-12-29 17:57:00,3 weeks,"What can I say about Apple products, the ecosystem is simply fabulous, they work Great !!!",1
143,8,5,Great AirPods,2019-07-12 15:53:00,1 month,Really like the sleek design and comfortable fit of these headphones. Good long tasing battery and easy pairing if you are in an apple ecosystem,1
144,8,5,Excellent product for anyone!,2019-08-22 07:15:00,Not Available,Easy to use wireless headphones that have a great sound system. You can use them practically anywhere and they don’t feel big on your ear like some other headphones.,1
145,8,5,Excellent Airpods to Explore.,2020-01-01 20:58:00,less than 1 week,Loved my new AirPods Sound quality & speaker system. It’s so easy to handle . Looks Stylish and fit to ears perfect. Very compact case to carry places.,1
146,8,5,Life Changing,2020-03-27 15:44:00,1 month,I love using the AirPods because it fits throughout my apple product ecosystem. Best purchase this year.,1
147,8,5,Great budd,2022-12-30 16:15:00,1 month,Great sounding buds. Full Apple ecosystem experience.,1
148,8,5,Very nice,2019-07-17 21:34:00,3 months,"Can’t go wrong with it if but in the Apple ecosystem.
Just don’t do sports with it.",1
149,8,4,Great wireless ear buds.,2020-02-23 16:06:00,3 weeks,My daughter loves it. She uses them almost everyday. Very easy setup if you are in the Apple ecosystem.,1
150,8,4,Decent Quality,2019-10-11 15:50:00,3 weeks,"Excellent pairing with the iPhone. Users not in the Apple ecosystem, are better served with other products.",1
151,8,5,Best AirPods,2020-12-21 14:41:00,1 week,"Best quality super clean AirPods, they have an amazing sound system and work great for any type of person who wants to listen to music I’m very have with my purchase!",1
152,8,4,Wife birthday present,2022-12-06 22:37:00,1 week,"She uses then daily, i feel like i should have bought the wireless charging ones. Then itd fit my ecosystem.",1
153,8,5,Just works,2021-06-20 09:05:00,2 weeks,Being in the Apple ecosystem these are a must have. This is the third pair i bought for different family members. Switches over to different devices seamlessly without fail.,1
154,8,4,Meh,2022-05-21 06:15:00,1 month,Got these for my girlfriend and she likes them but i dont think they sound good but aye ya pay for the ecosystem i guess lol,0
155,8,5,Good buy,2022-11-11 15:49:00,1 week,"Nice, comfortable headphones with good sound. They work really well with the Apple ecosystem.",1
156,8,5,Great,2020-08-29 18:31:00,1 year,You can’t go wrong with buying Apple. The Apple AirPods are one of a kind and blend so well with the Apple ecosystem.,1
157,8,4,They work,2020-11-06 23:24:00,3 weeks,Works well in apple ecosystem (obviously). Good sound and easy to use,1
158,8,5,Love the Buds,2021-05-08 13:32:00,4 months,I love these buds. They have great sound and last. I love the charging container. However the buds and case are easy misplaced. Lately I’ve spend a lot of time looking for them( BabyBoomer trait). I wish they had an active tracking system like my phone. I am a Apple girl.,1
159,8,5,Better than the beats,2022-04-20 22:10:00,1 month,"The bass on these could be better but for anyone in the iPhone ecosystem, it is a great buy. The sync process is seamless on the iphone and the sound is loud enough.",1
160,9,5,Review,2021-05-21 16:56:00,3 weeks,Quality apple product as usual. Very easy to use within the apple ecosystem,1
161,9,5,Convenient,2021-02-03 21:46:00,Not Available,Works great and is easy to use. Especially if you are in the Apple ecosystem!,1
162,9,5,More talk less music,2020-06-13 10:50:00,1 month,"Purchased for my wife to use while she is on calls. She is very happy with sound and and ease of use. I can’t comment on them for music as my wife can’t tell the difference between music coming from her phone speakers and my $20,000 reference system.",1
163,9,5,good headphones,2020-04-17 15:49:00,4 months,great sound quality and works really well with the apple ecosystem,1
164,9,5,Only the best from Apple,2020-08-07 21:51:00,6 months,"Without comprimise and part of the Apple ecosystem that provides the best user experience. Yes they are expensive relative to competitors, but the experience isn't the same, its the best of what's available today.",1
165,9,5,Favorite wireless headphones.,2020-05-01 17:34:00,Not Available,"Integration in the Apple ecosystem is so great. If the normal, wired headphones are comfortable to you, these will be too. Great for working out, assuming they fit in your ears properly! No complaints. Love them",1
166,9,5,Another apple winner,2020-09-25 12:45:00,Not Available,Great headphones for anyone in the Apple ecosystem. They pair easily and work well. What else would you expect from an Apple device?  Yes they are priced like an Apple device.,1
167,9,5,Must have for iPhone owners,2020-12-04 18:16:00,11 months,My daughter -a fangirl lol- lives by her airpods. They're not for the non-Apple world but if you're (stuck) in that ecosystem you won't regret owning these. :),1
168,9,5,Seamless,2019-08-20 21:38:00,2 weeks,"The integration with iOS is perfect and these work exactly like you would hope they would. There may be better options out there that are similarly priced, but if you’re in the Apple ecosystem, these are a no-brainer.",1
169,9,5,AirPod Purchase Made Easy by Best Buy,2021-01-16 17:40:00,1 month,"I have a pair of AirPods and liked them. My wife mentioned she might like a pair too, and they indeed ended up being a great Christmas gift. I used the Best Buy curbside delivery after ordering on line. It's a great service with a nice system they have set up for confirming where you are parked in their lot and getting your purchase to you.",1
170,9,5,Overpriced,2020-09-03 15:00:00,11 months,"It’s definitely overpriced, but if you’re highly invested in the Apple Ecosystem its definitely the only option you really have when it comes to wireless earbuds.",1
171,9,5,Best fully wireless headphones  for convenience!,2019-07-18 12:11:00,2 months,The super light fit and functionality definitely hits the mark for what I was looking for from wireless earphones. For someone full involved in the Apple ecosystem this purchase is nearly a no brainer!,1
172,9,5,Best for Apple products,2019-08-13 10:20:00,1 week,"Airpods are just the best for using with Apple products. They are good for most people in terms of sound, features and ease of use.  A bit pricey but a great addition to any Apple ecosystem.",1
173,9,5,AirPods,2019-11-01 15:43:00,1 month,"Best wireless headphones for any occasion. Also tip for any Dj's our there, they were great as earplugs for hearing protection against loud Club systems. Obviously they’re not meant for that but they seem to work great while I’m not on the decks and loud music is playing is playing in the background. Overall I use them for another reference every time I finish a track! Great Headphones!",1
174,9,5,AirPods are just the best.,2019-11-15 17:01:00,1 month,AirPods & iPhone are just the best fit to anyone that is looking for quality and easy to use plus apple ecosystem it just can’t be beaten.  I love my AirPods.,1
175,9,5,Earphone,2023-08-24 13:07:00,6 months,"I love the earphones sound good no echo are very convenient to use If working out.
I ordered online and was ready in 30 minutes it was ready to pick up love it",1
176,9,5,Awesome sound - decent upgrade,2019-05-04 13:51:00,Not Available,"These are still the best no wire headphones around if you have investment into Apple system. One surprise for me - I didn’t expect to use the Siri integration as much as I have. Too bad I’ve misplaced or loss my pair, major bummer but I recommend to purchasers.",1
177,9,4,Good quality ear buds,2020-01-16 19:08:00,2 weeks,"Apple's AirPods are the usual, well-integrated Apple product. It's nice to be able to use them with several Mac systems, my iPhone, and my iPad. Downsides: they don't stay in my ears very well, and sometimes my Mac laptop gets a bit confused when I'm NOT using the AirPods (the speakers have to be switched off and on to make them work again).",1
178,9,5,Great Headphones,2021-05-14 12:58:00,Not Available,If you're in the Apple ecosystem then these are the headphones to get...so long as the fit works. Instant pairing and great sound.,1
179,9,5,AirPods,2021-02-20 18:18:00,less than 1 week,Work great! Wireless headphones from Apple are a great integration within Apple ecosystem. Great gift giver as well!,1
180,10,5,Best pairing and device switching.,2021-01-01 15:34:00,Not Available,Best and most user friendly wireless earbuds. I highly recommend for Apple users and other ecosystem owners.,1
181,10,5,Solid and dependable,2020-01-11 08:34:00,Not Available,"If you are in the Apple ecosystem, these are a solid set of headphones.  They instantly connect upon opening and the sound is decent.",1
182,10,5,The simplest solution for iPhone owners.,2019-11-01 06:57:00,1 month,"They sound good enough for everyday use, they last plenty long, and they are they’re integrated beautifully into the Apple ecosystem.",1
183,10,5,Best and Easy to use,2020-08-22 00:11:00,8 months,Best for users in the Apple Ecosystem. Simple to use between multiple devices.  Battery case is great.,1
184,10,4,The best overall headphones,2021-05-03 00:25:00,2 weeks,"The ecosystem that apple created is amazing 
Everything made by them is in harmony with the iphone
This is the best easy to use, good quality and reliable 
Headphones.",1
185,10,5,Solid,2020-05-21 13:10:00,1 month,They obviously don't have the best sound quality but the ease of use with the apple ecosystem is great.,1
186,10,5,Worth for the money,2019-04-10 18:11:00,Not Available,"Wonderful product , highly recommended if you own all type of apple products. Kudos to apple ecosystem for fast and instant connectivity.",1
187,10,5,so easy to use,2020-07-11 16:07:00,3 weeks,love them and have never had issues. they fit right into the apple ecosystem and they are easy to use and get started. sound quality is good as well.,1
188,10,5,Pair easily,2019-10-04 17:23:00,3 weeks,These work well if you are in the Apple ecosystem. I recommend them highly. Sound good and fit well.,1
189,10,5,Awesome voice quality,2019-10-24 01:59:00,1 week,"Easy to pair. Fits well and has good quality sound.
If you are in an apple ecosystem a must buy.",1
190,10,5,Apple Product,2019-10-07 14:57:00,2 months,Another amazing apple product. Love the features and its ease of use with the Apple Ecosystem.,1
191,10,4,Good,2020-06-21 10:53:00,6 months,"they do their job. For the price there are better pods in the market, but if staying in the Apple ecosystem is what you want, this are the ones for you",0
192,10,5,AirPods are best,2020-02-14 16:54:00,3 weeks,"I tried galaxy buds, jabra 65t, amazon echo buds but this one has its own advantage and ease. Go for it",1
193,10,4,Very convenient headphones,2019-12-27 17:12:00,Not Available,"Nothing beats the apple ecosystem. Sound quality is decent, but the convenience of these headphone is top notch.",1
194,10,5,Perfect fit and sound,2020-01-06 18:22:00,1 month,"I just got these as a gift for my daughter and she loves them. They have a comfortable fit and an easy to use operations system. 

They are a good length and aren't too long or bulky. That was the main complaint for the earbuds this set replaced. 

Sound clarity is awesome! From streaming music to watching movies they have a great balance. There is no delay from side to side. 

I would definitely get these as a gift again.",1
195,10,4,2nd Gen AirPods,2022-05-08 11:23:00,2 weeks,"Great wireless headphones to go along with Apple's ecosystem. Fast connection, good sound and the ability to have your text's read as well as text back is fantastic.",1
196,10,5,Convenience is the key,2020-06-19 17:51:00,3 weeks,"Are there better headphones for the price? Of course, but for the sound quality that these do have, and for the convenience they provide inside of the apple ecosystem… They’re a must have",0
197,10,5,As expected,2021-01-01 22:07:00,2 weeks,Excellent for those who don’t care about sound wuality but more warranty or apple ecosystem  . Recommend getting ear hooks for ear from Online .,1
198,10,5,No replacement for next two years,2020-04-10 19:07:00,1 month,This is the pods you are looking for! Specially if you are in the Apple ecosystem. Seamless connectivity and transition between difference devices. The answer to all my solutions.,1
199,10,5,Make for great gifts,2019-12-09 00:29:00,1 week,"Already own a pair, so got my family member a pair they will absolutely love them.  She is very much integrated in the apple ecosystem",1
200,11,5,Excellent,2020-04-03 15:44:00,1 month,Hear very clear. No echo sound when using the airpods.,1
201,11,5,Love the my new AirPods!,2019-08-19 14:06:00,3 weeks,"I have absolutely zero complaints!! My AirPods work like a charm and they are worth every penny. They work great with both my iPhone and iPad and I can't stop using them. I definitely would recommend the AirPods, especially if you're in the Apple ecosystem already.",1
202,11,4,Really Good if You Already Have other Apple stuff,2021-03-05 15:41:00,Not Available,"Really great if you're already part of the Apple ecosystem. Good sound quality, charges really quickly and last fairly long. The integration with other apple products is really what sets these apart in my opinion.",1
203,11,5,Wife Loves It,2020-04-18 13:48:00,less than 1 week,My wife wanted some reliable bluetooth headphones for her telehealth meetings. Couldn't ask for anything better than this. It's a better upgrade over the Echo Buds we had before.,1
204,11,5,"Perfect, Handy for everything.",2022-01-16 15:04:00,7 months,"They're perfect, even if you're not in the apple ecosystem. I enjoy how quickly they pair to any device, and the sound quality is good enough for my needs.",1
205,11,5,Oldie but goodie,2021-07-23 16:19:00,1 month,"Not the best sounding or most comfortable, but Still a great set of ear buds. With the lower price all the features when working with iOS and MacOS, its easy to integrate into your Apple ecosystem.",1
206,11,5,Great fit for my 12 year old,2020-02-14 17:33:00,3 weeks,"These are fantastic for anyone looking for impressive sounds quality, especially as a part of apple’s ecosystem. These were purchased for my 12 year old son and he loves them. They are a perfect fit, comfortable and very convenient. Highly recommend",1
207,11,5,Great Wireless Earbuds!,2021-03-30 14:39:00,2 weeks,"I was hesitant at first to get these but, I am so happy that I did. These AirPods were just what I was looking for when it comes to quality and features. The battery system on these are great! They last long enough for daily use and charge fast enough when back in the charging case. They pair easily and work wonders with Siri.",1
208,11,5,Best earbuds for iphone,2020-04-26 10:22:00,1 week,Hands down the best earbuds for the Apple ecosystem due simply for the fact of easy integration with all Apple products. Plus they sound slightly better than the cheap earbuds that come with your iPhone. Great for runners as well!,1
209,11,5,Worth it.,2021-06-05 12:38:00,Not Available,"Love these. They work well, hold a charge for a long time.  Only problem I've had is that they can't win the fight against my car's bluetooth system (car always wins) but you can't have everything.  I love that they don't have rubber/silicone buds, but just hang off the ear.  Very happy.",1
210,11,5,Apple air pods,2020-05-08 18:28:00,4 months,"I bought both of my sons the Apple air pods for Christmas this year.  They use them every day. The house is a little quieter as they are listening to their own music. The charging system is perfect. It was the Best Buy for the money. The boys are very happy! The best thing is that they love them so much , they make sure to keep them safe and store them in their cases!",1
211,11,5,Pairs perfectly if you are locked into apple,2020-01-03 21:00:00,Not Available,"If you are in the apple ecosystem, AirPods are the absolute easiest to pair and just work. Each side works independently of the other, so if you need to just keep one side in for calls there is not a better solution.",1
212,11,5,Great headphones,2020-04-04 00:55:00,Not Available,"Great headphones that work seamlessly with my iPhone. If you’re already in the Apple ecosystem these will be easy to connect to your other Apple devices. 
Great sound and great microphone.",1
213,11,3,Great for Apple devices,2019-09-02 18:43:00,less than 1 week,"Works well in the Apple ecosystem, especially iPhone, iPad, and Apple TV. Good battery life. Doesn’t have great audio quality.",1
